{
  "version": 2,
  "project": {
    "fps": 30,
    "width": 1920,
    "height": 1080,
    "duration_frames": 90
  },
  "sources": [
    {"id": "v01", "path": "v01.mp4"}
  ],
  "video_tracks": [
    {
      "name": "aroll",
      "kind": "aroll",
      "clips": [
        {"src": "v01", "src_in": 0, "src_out": 90, "dst_in": 0, "dur": 90}
      ]
    },
    {
      "name": "gfx-overlay",
      "kind": "gfx",
      "clips": [
        {"src": "gfxA.html", "dst_in": 0, "dur": 90}
      ]
    }
  ],
  "subtitles": [
    {"in": 5, "out": 30, "text": "虚拟歌手搞笑视频·skill-demo"},
    {"in": 33, "out": 58, "text": "三阶段极简流程：素材→编排→渲染"},
    {"in": 61, "out": 88, "text": "零 apps/plugins 依赖，内核直出"}
  ],
  "audio_tracks": [
    {
      "name": "voice",
      "events": [
        {"src": "v01", "src_in": 0, "in": 0, "out": 90, "volume": 1.0}
      ]
    },
    {
      "name": "bed",
      "duck": true,
      "events": [
        {"src": "v01", "src_in": 0, "in": 0, "out": 90, "volume": 0.25}
      ]
    }
  ]
}
