{
  "version": 2,
  "project": {
    "fps": 30,
    "width": 1920,
    "height": 1080,
    "duration_frames": 360
  },
  "sources": [
    {"id": "a", "path": "a.mp4"},
    {"id": "b", "path": "b.mp4"}
  ],
  "video_tracks": [
    {
      "name": "base",
      "kind": "aroll",
      "clips": [
        {"src": "a", "src_in": 0, "src_out": 180, "dst_in": 0, "dur": 180},
        {"src": "b", "src_in": 0, "src_out": 180, "dst_in": 180, "dur": 180}
      ]
    },
    {
      "name": "effects",
      "kind": "gfx",
      "clips": [
        {"src": "gfx/canvas.html", "dst_in": 30, "dur": 60},
        {"src": "gfx/dom.html", "dst_in": 240, "dur": 60}
      ]
    }
  ],
  "subtitles": [
    {"in": 20, "out": 100, "text": "标准示例·第一段：普通素材"},
    {"in": 140, "out": 230, "text": "跨段字幕：横穿第 180 帧剪辑点"},
    {"in": 245, "out": 315, "text": "DOM 静态区间与低 alpha 检验"}
  ],
  "audio_tracks": [
    {
      "name": "bed",
      "events": [
        {"src": "a", "in": 0, "out": 360, "loop": true, "volume": 0.3}
      ]
    },
    {
      "name": "second",
      "events": [
        {"src": "b", "in": 120, "out": 270, "volume": 0.25}
      ]
    }
  ]
}
